{
  "$schema": "https://spoon.local/schemas/seed-curriculum.schema.json",
  "schemaVersion": 1,
  "kind": "spoon-seed-curriculum",
  "id": "programming-foundations",
  "version": "0.1.0",
  "title": "Programming foundations and safe repository workflow",
  "domain": "programming",
  "evidence": {
    "level": "Declared/design-only",
    "runnerStatus": "not-implemented",
    "claimBoundary": "This manifest designs learning probes over authorized fixture repositories; it does not claim repository indexing, grounded explanation, patching, or test execution is currently available through seed files.",
    "independentReviewRequired": true
  },
  "objective": "Acquire a grounded repository model and a reusable inspect-hypothesize-change-test workflow that explains code from observed evidence and keeps mutation scoped and reversible.",
  "scope": {
    "included": [
      "scoped repository tree and file observations",
      "manifest, language, module, symbol, type, import, and test relationships",
      "diagnostic interpretation and evidence-linked repository explanations",
      "inspect -> hypothesize -> minimal patch -> focused checks -> evaluate workflow"
    ],
    "excluded": [
      "ambient shell or filesystem authority",
      "unreviewed broad rewrites or dependency upgrades",
      "network access and credentials unless separately granted",
      "claims unsupported by observed files, diagnostics, or test output"
    ]
  },
  "lessonContract": {
    "teacherProtocol": "pure_expr_v2",
    "draftShape": [
      "concepts",
      "relationships",
      "procedures",
      "invocation",
      "contracts",
      "interpretations"
    ],
    "teacherSuppliedFields": [
      "concept names and descriptions",
      "relationship references",
      "procedure parameter names",
      "pure procedure bodies and contract checks",
      "invocation inputs"
    ],
    "engineOwnedFields": [
      "stable IDs",
      "lifecycle",
      "versions",
      "timestamps",
      "confidence",
      "mutability",
      "test cases"
    ],
    "testCasePolicy": "engine-generated-and-replayed-from-curriculum"
  },
  "requiredNativeOperations": [
    {
      "name": "observation.repository_tree",
      "role": "Observe a bounded, authorized repository tree with fingerprints.",
      "determinism": "observation",
      "status": "declared-not-verified"
    },
    {
      "name": "observation.file_content_scoped",
      "role": "Read named files and source spans within an explicit fixture boundary.",
      "determinism": "observation",
      "status": "declared-not-verified"
    },
    {
      "name": "observation.parse_source_spans",
      "role": "Extract syntax, symbols, types, imports, and diagnostics with provenance.",
      "determinism": "deterministic",
      "status": "declared-not-verified"
    },
    {
      "name": "sandbox.run_focused_check",
      "role": "Run a bounded compiler, formatter, linter, or test command in a sandbox.",
      "determinism": "effectful",
      "status": "declared-not-verified"
    },
    {
      "name": "repository.diff_scoped",
      "role": "Inspect and constrain a proposed change before applying it.",
      "determinism": "deterministic",
      "status": "declared-not-verified"
    },
    {
      "name": "repository.patch_scoped",
      "role": "Apply only an authorized minimal patch and retain a reversible diff.",
      "determinism": "effectful",
      "status": "declared-not-verified"
    },
    {
      "name": "programming.ir_lower_typed_ast",
      "role": "Lower neutral Spoon semantics into a typed target AST with source maps and explicit runtime shims.",
      "determinism": "deterministic",
      "status": "declared-not-verified"
    },
    {
      "name": "programming.ast_lift_ir_candidate",
      "role": "Lift representable source AST regions into neutral candidate procedures with source-span provenance.",
      "determinism": "deterministic",
      "status": "declared-not-verified"
    },
    {
      "name": "programming.differential_equivalence",
      "role": "Compare IR and generated-code outputs, failures, effects, and resource envelopes over bounded cases.",
      "determinism": "deterministic",
      "status": "declared-not-verified"
    }
  ],
  "requiredCapabilities": [
    {
      "name": "repository.fixture.read",
      "purpose": "Read a named synthetic repository fixture and its manifests, source, tests, and diagnostics.",
      "authority": "scoped-read",
      "effects": ["file-read"],
      "grantPolicy": "local-explicit-grant",
      "status": "declared-not-verified",
      "fixtureBoundary": "one fixture repository root selected by the local operator"
    },
    {
      "name": "repository.fixture.test",
      "purpose": "Execute a bounded focused check against the selected fixture with declared resource limits.",
      "authority": "sandbox",
      "effects": ["process-exec"],
      "grantPolicy": "local-explicit-grant",
      "status": "declared-not-verified",
      "fixtureBoundary": "sandboxed fixture process with no ambient network"
    },
    {
      "name": "repository.fixture.patch",
      "purpose": "Permit a minimal reversible patch only inside a selected fixture worktree.",
      "authority": "scoped-write",
      "effects": ["file-write"],
      "grantPolicy": "local-explicit-grant",
      "status": "declared-not-verified",
      "fixtureBoundary": "operator-approved fixture worktree; no parent traversal"
    }
  ],
  "demonstrations": [
    {
      "id": "demonstrate-repository-observation",
      "purpose": "Build a grounded repository model from bounded tree, manifest, source, and test observations.",
      "teacherMode": "on",
      "taskModel": {
        "inputShape": "a small authorized fixture repository containing a manifest, multiple modules, symbols, imports, and focused tests",
        "operation": "observe files and source spans, detect toolchain, and construct evidence-linked repository relationships",
        "variationPolicy": {
          "surfaceVariation": "repository-variants",
          "valueVariation": "held-out-repository",
          "structureVariation": "none"
        },
        "noAnswerDump": true
      },
      "expectedBehavior": [
        "Every repository claim links to an observed file or span.",
        "The model records modules, symbols, imports, tests, and toolchain assumptions.",
        "Unobserved behavior remains uncertain."
      ],
      "expectedDisposition": "accept",
      "evidence": {
        "tier": "consensus",
        "oracle": "mixed",
        "assertions": [
          "Independent tree and source observations support the model.",
          "The model does not contain ambient paths or secrets."
        ]
      }
    },
    {
      "id": "demonstrate-safe-test-loop",
      "purpose": "Show the safe inspect-hypothesize-change-test loop on an authorized fixture with a narrow failing check.",
      "teacherMode": "on",
      "taskModel": {
        "inputShape": "a fixture repository with one intentional, localized test failure and an explicit change boundary",
        "operation": "inspect evidence, state a hypothesis, propose a minimal patch, run a focused check, and evaluate the diff",
        "variationPolicy": {
          "surfaceVariation": "repository-variants",
          "valueVariation": "held-out-repository",
          "structureVariation": "new-composition"
        },
        "noAnswerDump": true
      },
      "expectedBehavior": [
        "Inspect before mutating.",
        "Patch only within the approved scope.",
        "Run the smallest relevant check and retain failure evidence if it does not pass."
      ],
      "expectedDisposition": "accept",
      "evidence": {
        "tier": "hard",
        "oracle": "deterministic",
        "assertions": [
          "The focused check gives a reproducible result.",
          "The diff is bounded and explainable."
        ]
      }
    }
  ],
  "counterexamples": [
    {
      "id": "counter-ungrounded-repository-explanation",
      "purpose": "Reject fluent explanations that assert modules, behavior, or dependencies not supported by repository evidence.",
      "teacherMode": "on",
      "taskModel": {
        "inputShape": "a repository question whose tempting answer mentions an absent symbol, file, dependency, or runtime behavior",
        "operation": "compare proposed claims against observed tree, source spans, manifests, tests, and diagnostics",
        "variationPolicy": {
          "surfaceVariation": "repository-variants",
          "valueVariation": "held-out-repository",
          "structureVariation": "new-error-boundary"
        },
        "noAnswerDump": true
      },
      "expectedBehavior": [
        "Reject unsupported claims or mark them uncertain.",
        "Cite the evidence used for each accepted claim.",
        "Ask for observation or scope when evidence is missing."
      ],
      "expectedDisposition": "abstain",
      "evidence": {
        "tier": "consensus",
        "oracle": "independent-judge",
        "assertions": [
          "Unsupported claims are not presented as facts.",
          "Evidence links are preserved in the response plan."
        ]
      },
      "failureSignal": "A plausible narrative is accepted without a matching file, symbol, test, or observed diagnostic."
    },
    {
      "id": "counter-broad-unsafe-change",
      "purpose": "Reject a workflow that mutates outside scope or skips focused validation.",
      "teacherMode": "on",
      "taskModel": {
        "inputShape": "a fixture with a localized defect and a proposed patch that touches unrelated files or runs an unbounded command",
        "operation": "check authority, diff scope, resource bounds, and validation ordering before execution",
        "variationPolicy": {
          "surfaceVariation": "repository-variants",
          "valueVariation": "held-out-repository",
          "structureVariation": "new-error-boundary"
        },